{
  "narrative_arc": "problem-solution",
  "estimated_duration_minutes": 30,
  "total_slides": 3,
  "slides": [
    {
      "slide_number": 1,
      "slide_type": "title",
      "headline": "Building Production AI Agents",
      "body_points": [],
      "narrative_beat": "hook",
      "visual_direction": "Abstract network of connected nodes in deep blue, conveying interconnected intelligence",
      "visual_type": "hero_image",
      "layout_template": "title"
    },
    {
      "slide_number": 2,
      "slide_type": "content",
      "headline": "The Agent Loop Is Simple",
      "body_points": [
        "Receive input from user",
        "Call tools in a loop",
        "Return results when done"
      ],
      "narrative_beat": "evidence-1",
      "visual_direction": "Simple flowchart showing a circular loop with three steps",
      "visual_type": "diagram",
      "layout_template": "content",
      "transition_note": "Now that we've set the stage, let's look at how agents actually work..."
    },
    {
      "slide_number": 3,
      "slide_type": "closing",
      "headline": "Start Simple, Iterate Fast",
      "body_points": [
        "Begin with the simplest agent that could work",
        "Add complexity only when you hit limits"
      ],
      "narrative_beat": "cta",
      "visual_type": "none",
      "layout_template": "closing"
    }
  ]
}
